<?xml version="1.0" encoding="UTF-8"?>
<xs:schema xmlns:xs="http://www.w3.org/2001/XMLSchema" elementFormDefault="qualified">
  <xs:element name="lugar">
  </xs:element>
  <xs:element name="ciudad">
    <xs:complexType>
      <xs:sequence>
        <xs:element name="pais" type="xs:string"/>
        <xs:element name="nombre" type="xs:string"/>
        <xs:element ref="observaciones"/>
      </xs:sequence>
    </xs:complexType>
  </xs:element>
  <xs:element name="hotel">
    <xs:complexType>
      <xs:sequence>
        <xs:element name="nombre" type="xs:string"/>
        <xs:element name="categoria" type="xs:string"/>
        <xs:element ref="observaciones"/>
      </xs:sequence>
    </xs:complexType>
  </xs:element>
  <xs:element name="observaciones" type="xs:string"/>
</xs:schema>
